{
  "version": 1,
  "id": "seed-router-triangle",
  "name": "Router Triangle",
  "description": "Three routers in a full mesh — OSPF/EIGRP adjacencies, redundancy and path selection.",
  "created": "2026-07-02T00:00:00Z",
  "modified": "2026-07-02T00:00:00Z",
  "canvas": { "zoom": 1, "pan": { "x": 0, "y": 0 }, "background": "dots" },
  "nodes": [
    { "id": 0, "kind": "iol", "name": "R1", "x": 330, "y": 110, "ram": 1024, "ethernet": 1, "serial": 0,
      "image": { "id": "seed-l3", "filename": "L3.bin", "class": "l3" } },
    { "id": 1, "kind": "iol", "name": "R2", "x": 160, "y": 340, "ram": 1024, "ethernet": 1, "serial": 0,
      "image": { "id": "seed-l3", "filename": "L3.bin", "class": "l3" } },
    { "id": 2, "kind": "iol", "name": "R3", "x": 500, "y": 340, "ram": 1024, "ethernet": 1, "serial": 0,
      "image": { "id": "seed-l3", "filename": "L3.bin", "class": "l3" } }
  ],
  "links": [
    { "id": 0, "type": "p2p", "endpoints": [ { "node": 0, "interface": "e0/0" }, { "node": 1, "interface": "e0/0" } ] },
    { "id": 1, "type": "p2p", "endpoints": [ { "node": 1, "interface": "e0/1" }, { "node": 2, "interface": "e0/1" } ] },
    { "id": 2, "type": "p2p", "endpoints": [ { "node": 2, "interface": "e0/0" }, { "node": 0, "interface": "e0/1" } ] }
  ]
}
