{
  "version": 1,
  "id": "seed-campus",
  "name": "Campus Topology",
  "description": "Classic three-tier campus: edge router, redundant core pair, dual-homed access switches, end hosts.",
  "created": "2026-07-02T00:00:00Z",
  "modified": "2026-07-02T00:00:00Z",
  "canvas": { "zoom": 1, "pan": { "x": 0, "y": 0 }, "background": "dots" },
  "nodes": [
    { "id": 0, "kind": "iol", "name": "EDGE", "x": 340, "y": 70, "ram": 1024, "ethernet": 1, "serial": 0,
      "image": { "id": "seed-l3", "filename": "L3.bin", "class": "l3" } },
    { "id": 1, "kind": "iol", "name": "CORE1", "x": 200, "y": 210, "ram": 1024, "ethernet": 2, "serial": 0,
      "image": { "id": "seed-l2", "filename": "L2.bin", "class": "l2" } },
    { "id": 2, "kind": "iol", "name": "CORE2", "x": 480, "y": 210, "ram": 1024, "ethernet": 2, "serial": 0,
      "image": { "id": "seed-l2", "filename": "L2.bin", "class": "l2" } },
    { "id": 3, "kind": "iol", "name": "ACC1", "x": 200, "y": 370, "ram": 1024, "ethernet": 2, "serial": 0,
      "image": { "id": "seed-l2", "filename": "L2.bin", "class": "l2" } },
    { "id": 4, "kind": "iol", "name": "ACC2", "x": 480, "y": 370, "ram": 1024, "ethernet": 2, "serial": 0,
      "image": { "id": "seed-l2", "filename": "L2.bin", "class": "l2" } },
    { "id": 5, "kind": "vpcs", "name": "PC1", "x": 200, "y": 500 },
    { "id": 6, "kind": "vpcs", "name": "PC2", "x": 480, "y": 500 }
  ],
  "links": [
    { "id": 0, "type": "p2p", "endpoints": [ { "node": 0, "interface": "e0/0" }, { "node": 1, "interface": "e0/0" } ] },
    { "id": 1, "type": "p2p", "endpoints": [ { "node": 0, "interface": "e0/1" }, { "node": 2, "interface": "e0/0" } ] },
    { "id": 2, "type": "p2p", "endpoints": [ { "node": 1, "interface": "e0/1" }, { "node": 2, "interface": "e0/1" } ] },
    { "id": 3, "type": "p2p", "endpoints": [ { "node": 1, "interface": "e0/2" }, { "node": 3, "interface": "e0/0" } ] },
    { "id": 4, "type": "p2p", "endpoints": [ { "node": 1, "interface": "e0/3" }, { "node": 4, "interface": "e0/0" } ] },
    { "id": 5, "type": "p2p", "endpoints": [ { "node": 2, "interface": "e0/2" }, { "node": 3, "interface": "e0/1" } ] },
    { "id": 6, "type": "p2p", "endpoints": [ { "node": 2, "interface": "e0/3" }, { "node": 4, "interface": "e0/1" } ] },
    { "id": 7, "type": "p2p", "endpoints": [ { "node": 3, "interface": "e0/2" }, { "node": 5, "interface": "eth0" } ] },
    { "id": 8, "type": "p2p", "endpoints": [ { "node": 4, "interface": "e0/2" }, { "node": 6, "interface": "eth0" } ] }
  ]
}
