{
  "version": 1,
  "id": "seed-ccna-capstone",
  "name": "CCNA Capstone",
  "description": "Small enterprise: dual routers to an internet NAT gateway, switched LAN with VLANs, end hosts. Practice: addressing, VLANs + trunking, inter-VLAN routing, OSPF, NAT, DHCP.",
  "created": "2026-07-02T00:00:00Z",
  "modified": "2026-07-02T00:00:00Z",
  "canvas": { "zoom": 1, "pan": { "x": 0, "y": 0 }, "background": "dots" },
  "nodes": [
    { "id": 0, "kind": "nat", "name": "Internet", "x": 340, "y": 60 },
    { "id": 1, "kind": "iol", "name": "R1", "x": 220, "y": 190, "ram": 1024, "ethernet": 1, "serial": 0,
      "image": { "id": "seed-l3", "filename": "L3.bin", "class": "l3" } },
    { "id": 2, "kind": "iol", "name": "R2", "x": 460, "y": 190, "ram": 1024, "ethernet": 1, "serial": 0,
      "image": { "id": "seed-l3", "filename": "L3.bin", "class": "l3" } },
    { "id": 3, "kind": "iol", "name": "SW1", "x": 220, "y": 340, "ram": 1024, "ethernet": 2, "serial": 0,
      "image": { "id": "seed-l2", "filename": "L2.bin", "class": "l2" } },
    { "id": 4, "kind": "iol", "name": "SW2", "x": 460, "y": 340, "ram": 1024, "ethernet": 2, "serial": 0,
      "image": { "id": "seed-l2", "filename": "L2.bin", "class": "l2" } },
    { "id": 5, "kind": "vpcs", "name": "PC1", "x": 220, "y": 480 },
    { "id": 6, "kind": "vpcs", "name": "PC2", "x": 460, "y": 480 }
  ],
  "links": [
    { "id": 0, "type": "p2p", "endpoints": [ { "node": 0, "interface": "eth0" }, { "node": 1, "interface": "e0/0" } ] },
    { "id": 1, "type": "p2p", "endpoints": [ { "node": 1, "interface": "e0/1" }, { "node": 2, "interface": "e0/1" } ] },
    { "id": 2, "type": "p2p", "endpoints": [ { "node": 1, "interface": "e0/2" }, { "node": 3, "interface": "e0/0" } ] },
    { "id": 3, "type": "p2p", "endpoints": [ { "node": 2, "interface": "e0/2" }, { "node": 4, "interface": "e0/0" } ] },
    { "id": 4, "type": "p2p", "endpoints": [ { "node": 3, "interface": "e0/1" }, { "node": 4, "interface": "e0/1" } ] },
    { "id": 5, "type": "p2p", "endpoints": [ { "node": 3, "interface": "e0/2" }, { "node": 5, "interface": "eth0" } ] },
    { "id": 6, "type": "p2p", "endpoints": [ { "node": 4, "interface": "e0/2" }, { "node": 6, "interface": "eth0" } ] }
  ]
}
