{
  "version": 1,
  "id": "seed-2-routers",
  "name": "2 Routers",
  "description": "Two routers back to back — the simplest possible lab. Address e0/0 on each side and ping across.",
  "created": "2026-07-02T00:00:00Z",
  "modified": "2026-07-02T00:00:00Z",
  "canvas": { "zoom": 1, "pan": { "x": 0, "y": 0 }, "background": "dots" },
  "nodes": [
    { "id": 0, "kind": "iol", "name": "R1", "x": 180, "y": 200, "ram": 1024, "ethernet": 1, "serial": 0,
      "image": { "id": "seed-l3", "filename": "L3.bin", "class": "l3" } },
    { "id": 1, "kind": "iol", "name": "R2", "x": 480, "y": 200, "ram": 1024, "ethernet": 1, "serial": 0,
      "image": { "id": "seed-l3", "filename": "L3.bin", "class": "l3" } }
  ],
  "links": [
    { "id": 0, "type": "p2p", "endpoints": [ { "node": 0, "interface": "e0/0" }, { "node": 1, "interface": "e0/0" } ] }
  ]
}
