{
  "version": 1,
  "id": "seed-ccnp-core",
  "name": "CCNP ENCOR Core",
  "description": "Four-router core with redundant paths plus a switched edge. Practice: OSPF multi-area, EIGRP, BGP peering, redistribution, FHRP on the switch block.",
  "created": "2026-07-02T00:00:00Z",
  "modified": "2026-07-02T00:00:00Z",
  "canvas": { "zoom": 1, "pan": { "x": 0, "y": 0 }, "background": "dots" },
  "nodes": [
    { "id": 0, "kind": "iol", "name": "R1", "x": 200, "y": 120, "ram": 1024, "ethernet": 1, "serial": 0,
      "image": { "id": "seed-l3", "filename": "L3.bin", "class": "l3" } },
    { "id": 1, "kind": "iol", "name": "R2", "x": 500, "y": 120, "ram": 1024, "ethernet": 1, "serial": 0,
      "image": { "id": "seed-l3", "filename": "L3.bin", "class": "l3" } },
    { "id": 2, "kind": "iol", "name": "R3", "x": 200, "y": 300, "ram": 1024, "ethernet": 1, "serial": 0,
      "image": { "id": "seed-l3", "filename": "L3.bin", "class": "l3" } },
    { "id": 3, "kind": "iol", "name": "R4", "x": 500, "y": 300, "ram": 1024, "ethernet": 1, "serial": 0,
      "image": { "id": "seed-l3", "filename": "L3.bin", "class": "l3" } },
    { "id": 4, "kind": "iol", "name": "SW1", "x": 200, "y": 470, "ram": 1024, "ethernet": 2, "serial": 0,
      "image": { "id": "seed-l2", "filename": "L2.bin", "class": "l2" } },
    { "id": 5, "kind": "iol", "name": "SW2", "x": 500, "y": 470, "ram": 1024, "ethernet": 2, "serial": 0,
      "image": { "id": "seed-l2", "filename": "L2.bin", "class": "l2" } }
  ],
  "links": [
    { "id": 0, "type": "p2p", "endpoints": [ { "node": 0, "interface": "e0/0" }, { "node": 1, "interface": "e0/0" } ] },
    { "id": 1, "type": "p2p", "endpoints": [ { "node": 0, "interface": "e0/1" }, { "node": 2, "interface": "e0/1" } ] },
    { "id": 2, "type": "p2p", "endpoints": [ { "node": 1, "interface": "e0/1" }, { "node": 3, "interface": "e0/1" } ] },
    { "id": 3, "type": "p2p", "endpoints": [ { "node": 2, "interface": "e0/0" }, { "node": 3, "interface": "e0/0" } ] },
    { "id": 4, "type": "p2p", "endpoints": [ { "node": 0, "interface": "e0/2" }, { "node": 3, "interface": "e0/2" } ] },
    { "id": 5, "type": "p2p", "endpoints": [ { "node": 2, "interface": "e0/2" }, { "node": 4, "interface": "e0/0" } ] },
    { "id": 6, "type": "p2p", "endpoints": [ { "node": 3, "interface": "e0/3" }, { "node": 5, "interface": "e0/0" } ] },
    { "id": 7, "type": "p2p", "endpoints": [ { "node": 4, "interface": "e0/1" }, { "node": 5, "interface": "e0/1" } ] }
  ]
}
