{
  "version": 1,
  "id": "seed-4-switches",
  "name": "4 Switches",
  "description": "Square of switches with a cross-link — richer spanning-tree topologies, EtherChannel practice.",
  "created": "2026-07-02T00:00:00Z",
  "modified": "2026-07-02T00:00:00Z",
  "canvas": { "zoom": 1, "pan": { "x": 0, "y": 0 }, "background": "dots" },
  "nodes": [
    { "id": 0, "kind": "iol", "name": "SW1", "x": 180, "y": 130, "ram": 1024, "ethernet": 1, "serial": 0,
      "image": { "id": "seed-l2", "filename": "L2.bin", "class": "l2" } },
    { "id": 1, "kind": "iol", "name": "SW2", "x": 500, "y": 130, "ram": 1024, "ethernet": 1, "serial": 0,
      "image": { "id": "seed-l2", "filename": "L2.bin", "class": "l2" } },
    { "id": 2, "kind": "iol", "name": "SW3", "x": 500, "y": 380, "ram": 1024, "ethernet": 1, "serial": 0,
      "image": { "id": "seed-l2", "filename": "L2.bin", "class": "l2" } },
    { "id": 3, "kind": "iol", "name": "SW4", "x": 180, "y": 380, "ram": 1024, "ethernet": 1, "serial": 0,
      "image": { "id": "seed-l2", "filename": "L2.bin", "class": "l2" } }
  ],
  "links": [
    { "id": 0, "type": "p2p", "endpoints": [ { "node": 0, "interface": "e0/0" }, { "node": 1, "interface": "e0/0" } ] },
    { "id": 1, "type": "p2p", "endpoints": [ { "node": 1, "interface": "e0/1" }, { "node": 2, "interface": "e0/1" } ] },
    { "id": 2, "type": "p2p", "endpoints": [ { "node": 2, "interface": "e0/0" }, { "node": 3, "interface": "e0/0" } ] },
    { "id": 3, "type": "p2p", "endpoints": [ { "node": 3, "interface": "e0/1" }, { "node": 0, "interface": "e0/1" } ] },
    { "id": 4, "type": "p2p", "endpoints": [ { "node": 0, "interface": "e0/2" }, { "node": 2, "interface": "e0/2" } ] }
  ]
}
