{
  "version": 1,
  "id": "m4-multi-link",
  "name": "M4 multi-link",
  "description": "M4 item 2 multi-link run; run id is added by the hardware driver.",
  "canvas": {"zoom": 1, "pan": {"x": 0, "y": 0}, "background": "dots"},
  "nodes": [
    {
      "id": 0, "kind": "iol", "name": "R1", "x": 240, "y": 200,
      "image": {"id": "REPLACE_WITH_IMAGE_ID", "filename": "M4-image.bin", "class": "l3"},
      "ram": 1024, "ethernet": 1, "serial": 1,
      "startupConfig": "hostname R1\n!\ninterface Ethernet0/0\n ip address 10.0.12.1 255.255.255.0\n no shutdown\n!\ninterface Ethernet0/1\n ip address 192.168.1.1 255.255.255.0\n no shutdown\n!\nend\n"
    },
    {
      "id": 1, "kind": "iol", "name": "R2", "x": 560, "y": 200,
      "image": {"id": "REPLACE_WITH_IMAGE_ID", "filename": "M4-image.bin", "class": "l3"},
      "ram": 1024, "ethernet": 1, "serial": 1,
      "startupConfig": "hostname R2\n!\ninterface Ethernet0/0\n ip address 10.0.12.2 255.255.255.0\n no shutdown\n!\nend\n"
    },
    {
      "id": 2, "kind": "vpcs", "name": "PC1", "x": 240, "y": 400,
      "ethernet": 1, "serial": 0,
      "config": {"commands": ["ip 192.168.1.10 192.168.1.1 24"]}
    }
  ],
  "links": [
    {"id": 0, "type": "p2p", "endpoints": [{"node": 0, "interface": "e0/0"}, {"node": 1, "interface": "e0/0"}], "capture": {"enabled": false, "mode": "live"}},
    {"id": 1, "type": "p2p", "endpoints": [{"node": 0, "interface": "e0/1"}, {"node": 2, "interface": "eth0"}]}
  ]
}
